{
  "schema_version": "1.0.0",
  "id": "lpic1.103.1.q.type",
  "objective_ids": [
    "103.1"
  ],
  "concept_ids": [
    "lpic1.103.1.documentation-et-identification-d-une-commande"
  ],
  "type": "fill-in",
  "prompt_fr": "Quel builtin permet de savoir si un nom correspond à un alias, une fonction, un builtin ou un exécutable ?",
  "grading": {
    "strategy": "exact-text",
    "accepted_answers": [
      "type"
    ],
    "case_sensitive": true
  },
  "evidence_kind_on_success": "recall",
  "labels": [
    "lpic-required"
  ],
  "distribution": "generic",
  "explanation_fr": "`type` connaît les constructions du shell et permet aussi `type -a` pour afficher plusieurs résolutions."
}
