{
  "schema_version": "1.0.0",
  "id": "lpic1.103.1.q.history",
  "objective_ids": [
    "103.1"
  ],
  "concept_ids": [
    "lpic1.103.1.historique"
  ],
  "type": "fill-in",
  "prompt_fr": "Quel builtin Bash affiche l'historique connu de la session courante ?",
  "grading": {
    "strategy": "exact-text",
    "accepted_answers": [
      "history"
    ],
    "case_sensitive": true
  },
  "evidence_kind_on_success": "recall",
  "labels": [
    "lpic-required"
  ],
  "distribution": "generic",
  "explanation_fr": "`history` interroge l'historique du shell courant ; le fichier `.bash_history` n'est pas nécessairement synchronisé immédiatement."
}
